{"durationFrames":1350,"evidenceClass":"derived","framesPerSecond":30,"keyframes":[{"camera":[-7.041209956061647,-22.943874179280584,12],"frame":0,"routePointIndex":0,"target":[0,0,1.5]},{"camera":[335.963148799269,29.23571545283087,17.200000000000045],"frame":59,"routePointIndex":9,"target":[355.49775397460405,15.293004072192858,6.7000000000000455]},{"camera":[488.56664989763647,-414.53584020224946,25],"frame":117,"routePointIndex":18,"target":[509.5788566653779,-426.1327004130859,14.5]},{"camera":[848.9700815897604,-261.0187462958653,25.200000000000045],"frame":176,"routePointIndex":26,"target":[872.7380680712031,-264.347833050211,14.700000000000045]},{"camera":[1321.8743060791753,-151.050081631194,15.800000000000068],"frame":235,"routePointIndex":35,"target":[1340.436333834554,-166.26359948895944,5.300000000000068]},{"camera":[1597.6645305564382,-542.4775228148488,24.600000000000023],"frame":293,"routePointIndex":44,"target":[1600.4355532204731,-566.3170159595322,14.100000000000023]},{"camera":[1925.7545078063345,-693.0600984743492,27.600000000000023],"frame":352,"routePointIndex":53,"target":[1940.9658839574438,-711.6238813751877,17.100000000000023]},{"camera":[1728.3438125618193,-734.602541036664,40.60000000000002],"frame":411,"routePointIndex":61,"target":[1705.777528316791,-726.4316894670548,30.100000000000023]},{"camera":[1484.3387538325462,-340.1081599752914,6.600000000000023],"frame":469,"routePointIndex":70,"target":[1467.659431354439,-322.8512714471904,-3.8999999999999773]},{"camera":[1198.407211049891,49.79227689655245,14.800000000000068],"frame":528,"routePointIndex":79,"target":[1208.420228545697,71.60372986577669,4.300000000000068]},{"camera":[932.1668274831412,381.8523258042524,20.800000000000068],"frame":587,"routePointIndex":88,"target":[914.9741505980388,398.5978285295953,10.300000000000068]},{"camera":[608.0383911133619,693.7548597863755,11.400000000000091],"frame":645,"routePointIndex":97,"target":[587.2108725244551,705.6802306161964,0.900000000000091]},{"camera":[240.94185695366792,758.2266159846729,15.800000000000068],"frame":704,"routePointIndex":105,"target":[217.28506191537542,762.2708771676604,5.300000000000068]},{"camera":[-269.4089398159212,832.3072636984591,17.800000000000068],"frame":762,"routePointIndex":114,"target":[-293.1580071482442,835.7687374950937,7.300000000000068]},{"camera":[-638.0605241200982,802.4795833641707,27.40000000000009],"frame":821,"routePointIndex":123,"target":[-629.4592133831807,780.0738373688465,16.90000000000009]},{"camera":[-522.506320136158,513.3039242140588,33.60000000000002],"frame":880,"routePointIndex":132,"target":[-540.8437321507049,497.8204065062267,23.100000000000023]},{"camera":[-469.57701950750584,312.4555208936947,32.80000000000007],"frame":938,"routePointIndex":141,"target":[-446.6568390742452,305.3375626958139,22.300000000000068]},{"camera":[-140.71330838063946,90.46749799779005,11.400000000000091],"frame":997,"routePointIndex":149,"target":[-158.36538968631265,74.20699291406332,0.900000000000091]},{"camera":[-513.3570342950392,246.01073730753978,16],"frame":1056,"routePointIndex":158,"target":[-535.1313494899865,235.91721474150347,5.5]},{"camera":[-819.9032987227922,164.26487916611032,9.200000000000045],"frame":1114,"routePointIndex":167,"target":[-842.1228841760435,173.33626397140128,-1.2999999999999545]},{"camera":[-939.0224852838992,128.52617900010657,6.2000000000000455],"frame":1173,"routePointIndex":176,"target":[-915.0415714234335,127.56922005797483,-4.2999999999999545]},{"camera":[-615.7376625675942,132.55596878619076,5.2000000000000455],"frame":1232,"routePointIndex":184,"target":[-595.5833132052935,145.58678617353578,-5.2999999999999545]},{"camera":[-275.4591953178741,77.85936696709828,8.400000000000091],"frame":1290,"routePointIndex":193,"target":[-255.01007830670812,65.29618212154095,-2.099999999999909]},{"camera":[-48.633267312341964,-92.28773857501487,9.400000000000091],"frame":1349,"routePointIndex":202,"target":[-35.27947917928693,-112.22956252613525,-1.099999999999909]}],"schemaVersion":1,"timelineId":"route-teaser-45s-v1"}
